{
  "schema_version": "0.2",
  "generated_at": "2026-07-25T19:20:26.130642Z",
  "source": {
    "commit": null,
    "dirty": true
  },
  "nodes": [
    {
      "id": "capability.conhecer-o-cliente",
      "type": "spine",
      "name": "Conhecer o cliente",
      "status": "active",
      "spine_kind": "capability",
      "confidence": "hypothesis",
      "definition": "Capacidade de saber quem compra, o que prefere e com que frequência volta.",
      "areas": [],
      "source": {
        "path": "spine/capabilities/capability.conhecer-o-cliente.md"
      }
    },
    {
      "id": "capability.garantir-consistencia-da-bebida",
      "type": "spine",
      "name": "Garantir consistência da bebida",
      "status": "active",
      "spine_kind": "capability",
      "confidence": "hypothesis",
      "definition": "Capacidade de entregar a mesma qualidade de bebida em qualquer turno, com qualquer pessoa preparando.",
      "areas": [],
      "source": {
        "path": "spine/capabilities/capability.garantir-consistencia-da-bebida.md"
      }
    },
    {
      "id": "capability.garantir-insumos",
      "type": "spine",
      "name": "Garantir insumos",
      "status": "active",
      "spine_kind": "capability",
      "confidence": "hypothesis",
      "definition": "Capacidade de ter os insumos certos disponíveis no ponto de uso, no momento em que a operação precisa deles.",
      "areas": [],
      "source": {
        "path": "spine/capabilities/capability.garantir-insumos.md"
      }
    },
    {
      "id": "capability.garantir-transferencia-correta",
      "type": "spine",
      "name": "Garantir transferência correta",
      "status": "active",
      "spine_kind": "capability",
      "confidence": "hypothesis",
      "definition": "Capacidade de assegurar que o produto certo chega à posse do cliente certo, qualquer que seja o meio de transferência — balcão, entrega, retirada ou qualquer outro ponto de coleta.",
      "areas": [],
      "source": {
        "path": "spine/capabilities/capability.garantir-transferencia-correta.md"
      }
    },
    {
      "id": "capability.gerenciar-equipe",
      "type": "spine",
      "name": "Gerenciar equipe",
      "status": "active",
      "spine_kind": "capability",
      "confidence": "hypothesis",
      "definition": "Capacidade de ter pessoas certas, treinadas e escaladas para operar a loja.",
      "areas": [],
      "source": {
        "path": "spine/capabilities/capability.gerenciar-equipe.md"
      }
    },
    {
      "id": "capability.gerenciar-pedidos",
      "type": "spine",
      "name": "Gerenciar pedidos",
      "status": "active",
      "spine_kind": "capability",
      "confidence": "hypothesis",
      "definition": "Capacidade de registrar, acompanhar e coordenar pedidos desde sua solicitação até a entrega ou resolução.",
      "areas": [],
      "source": {
        "path": "spine/capabilities/capability.gerenciar-pedidos.md"
      }
    },
    {
      "id": "capability.honrar-compromissos-financeiros",
      "type": "spine",
      "name": "Honrar compromissos financeiros",
      "status": "active",
      "spine_kind": "capability",
      "confidence": "hypothesis",
      "definition": "Capacidade de liquidar as obrigações financeiras da loja — pagar fornecedores e demais contas devidas — no valor e no prazo acordados.",
      "areas": [],
      "source": {
        "path": "spine/capabilities/capability.honrar-compromissos-financeiros.md"
      }
    },
    {
      "id": "capability.processar-pagamentos",
      "type": "spine",
      "name": "Processar pagamentos",
      "status": "active",
      "spine_kind": "capability",
      "confidence": "hypothesis",
      "definition": "Capacidade de cobrar do cliente o valor correto no ato da venda e reconhecer esse recebimento no caixa. É o lado de contas a receber do financeiro — pagar fornecedores é a capacidade separada de honrar compromissos financeiros.",
      "areas": [],
      "source": {
        "path": "spine/capabilities/capability.processar-pagamentos.md"
      }
    },
    {
      "id": "event.entrega-de-insumos-aceita",
      "type": "spine",
      "name": "Entrega de insumos aceita",
      "status": "active",
      "spine_kind": "event",
      "confidence": "hypothesis",
      "definition": "Acontecimento relevante: a loja reconhece o recebimento de insumos enviados por um fornecedor.",
      "areas": [],
      "source": {
        "path": "spine/events/event.entrega-de-insumos-aceita.md"
      }
    },
    {
      "id": "invariant.caixa-sempre-conciliado",
      "type": "spine",
      "name": "Caixa sempre conciliado",
      "status": "active",
      "spine_kind": "invariant",
      "confidence": "hypothesis",
      "definition": "O que deve permanecer verdadeiro: a cada fechamento, o que entrou e o que saiu do caixa batem com o que foi registrado.",
      "areas": [],
      "source": {
        "path": "spine/invariants/invariant.caixa-sempre-conciliado.md"
      }
    },
    {
      "id": "invariant.insumo-vencido-nao-utilizado",
      "type": "spine",
      "name": "Insumo vencido não é utilizado",
      "status": "active",
      "spine_kind": "invariant",
      "confidence": "hypothesis",
      "definition": "O que deve permanecer verdadeiro: nenhum insumo fora da validade entra na produção de uma bebida.",
      "areas": [],
      "source": {
        "path": "spine/invariants/invariant.insumo-vencido-nao-utilizado.md"
      }
    },
    {
      "id": "objective.servir-cafe-rentavel",
      "type": "spine",
      "name": "Servir café com qualidade e margem",
      "status": "active",
      "spine_kind": "objective",
      "confidence": "hypothesis",
      "definition": "Resultado desejado: servir bebidas dentro do padrão da casa, com uma margem que sustente o negócio no longo prazo.",
      "areas": [],
      "source": {
        "path": "spine/objectives/objective.servir-cafe-rentavel.md"
      }
    },
    {
      "id": "obligation.pagar-fornecedor",
      "type": "spine",
      "name": "Pagar fornecedor",
      "status": "active",
      "spine_kind": "obligation",
      "confidence": "hypothesis",
      "definition": "O que se torna devido: a contraprestação financeira criada quando a loja aceita uma entrega de insumos.",
      "areas": [],
      "source": {
        "path": "spine/obligations/obligation.pagar-fornecedor.md"
      }
    },
    {
      "id": "value-stage.abastecer-operacao",
      "type": "spine",
      "name": "Abastecer operação",
      "status": "active",
      "spine_kind": "value-stage",
      "confidence": "hypothesis",
      "definition": "Transformação necessária: insumos disponíveis na loja, na quantidade e na condição necessárias para operar o dia.",
      "areas": [],
      "source": {
        "path": "spine/value-stages/value-stage.abastecer-operacao.md"
      }
    },
    {
      "id": "value-stage.coletar-pedido",
      "type": "spine",
      "name": "Coletar pedido",
      "status": "active",
      "spine_kind": "value-stage",
      "confidence": "hypothesis",
      "definition": "Transformação necessária: a intenção de compra do cliente é capturada de forma acionável, qualquer que seja o canal — balcão, totem, aplicativo ou qualquer outro meio ainda não inventado.",
      "areas": [],
      "source": {
        "path": "spine/value-stages/value-stage.coletar-pedido.md"
      }
    },
    {
      "id": "value-stage.disponibilizar-produto",
      "type": "spine",
      "name": "Disponibilizar produto",
      "status": "active",
      "spine_kind": "value-stage",
      "confidence": "hypothesis",
      "definition": "Transformação necessária: o produto do pedido fica pronto para ser passado ao cliente — seja produzido na hora, montado a partir de insumos, ou obtido já pronto, por exemplo comprado de terceiros para revenda.",
      "areas": [],
      "source": {
        "path": "spine/value-stages/value-stage.disponibilizar-produto.md"
      }
    },
    {
      "id": "value-stage.fidelizar-cliente",
      "type": "spine",
      "name": "Fidelizar cliente",
      "status": "active",
      "spine_kind": "value-stage",
      "confidence": "hypothesis",
      "definition": "Transformação necessária: o cliente volta e recomenda a loja a outras pessoas.",
      "areas": [],
      "source": {
        "path": "spine/value-stages/value-stage.fidelizar-cliente.md"
      }
    },
    {
      "id": "value-stage.preparar-loja",
      "type": "spine",
      "name": "Preparar loja",
      "status": "active",
      "spine_kind": "value-stage",
      "confidence": "hypothesis",
      "definition": "Transformação necessária: loja pronta para operar — limpa, equipada e com equipe escalada antes de receber o primeiro cliente.",
      "areas": [],
      "source": {
        "path": "spine/value-stages/value-stage.preparar-loja.md"
      }
    },
    {
      "id": "value-stage.receber-pagamento",
      "type": "spine",
      "name": "Receber pagamento",
      "status": "active",
      "spine_kind": "value-stage",
      "confidence": "hypothesis",
      "definition": "Transformação necessária: o pagamento é recebido e reconhecido pela operação.",
      "areas": [],
      "source": {
        "path": "spine/value-stages/value-stage.receber-pagamento.md"
      }
    },
    {
      "id": "value-stage.transferir-posse-ao-cliente",
      "type": "spine",
      "name": "Transferir posse ao cliente",
      "status": "active",
      "spine_kind": "value-stage",
      "confidence": "hypothesis",
      "definition": "Transformação necessária: a posse do produto passa para o cliente certo — por entrega, retirada no balcão, coleta em um ponto de encontro ou qualquer outro meio.",
      "areas": [],
      "source": {
        "path": "spine/value-stages/value-stage.transferir-posse-ao-cliente.md"
      }
    },
    {
      "id": "realization.abertura-e-fechamento-da-loja",
      "type": "realization",
      "name": "Abertura e fechamento da loja",
      "status": "active",